{
  "anchors": {
    "approach": [
      13,
      4,
      1
    ],
    "bedroom": [
      11,
      8,
      10
    ],
    "dining": [
      19,
      4,
      16
    ],
    "gallery": [
      17,
      8,
      15
    ],
    "hearth": [
      13,
      4,
      14
    ],
    "kitchen": [
      16,
      4,
      23
    ],
    "pantry": [
      5,
      4,
      25
    ],
    "porch": [
      13,
      4,
      6
    ],
    "rear_exit": [
      8,
      4,
      30
    ],
    "stair_bottom": [
      9,
      4,
      18
    ],
    "study": [
      24,
      8,
      12
    ],
    "upper_landing": [
      14,
      8,
      20
    ],
    "vestibule": [
      13,
      4,
      10
    ],
    "west_return": [
      2,
      4,
      19
    ],
    "workshop": [
      11,
      4,
      25
    ]
  },
  "connectors": [
    {
      "face": "south",
      "height": 3,
      "id": "south_road",
      "origin_local": [
        10,
        4,
        0
      ],
      "type": "house_entry",
      "width": 7
    },
    {
      "face": "north",
      "height": 3,
      "id": "rear_service",
      "origin_local": [
        7,
        4,
        31
      ],
      "type": "service_exit",
      "width": 2
    },
    {
      "face": "west",
      "height": 3,
      "id": "west_return",
      "origin_local": [
        0,
        4,
        18
      ],
      "type": "exterior_return",
      "width": 3
    }
  ],
  "id": "example:drafts/wayfarers_hearth_house",
  "meta": {
    "biome": "unassigned",
    "block_entities_forbidden": true,
    "dialect": "fantasy_roadside_timber_stone",
    "discovery": "projecting porch, cross-gabled timber house, west chimney, rear craft wing, and east reading bay",
    "entities_forbidden": true,
    "ground_level": 4,
    "max_occupied_blocks": 35000,
    "max_palette": 24,
    "notes": "Original non-shipping AIONSTRUCT reference design. Static evidence only. Lighting planner emitted 22 visible supported lanterns; no concealed sources.",
    "product_type": "landmark",
    "scatter_denominator": 1048576,
    "vertical_band": "prototype"
  },
  "mirror_policy": "mirror_none",
  "ops": [
    {
      "block": "cobble",
      "comment": "main house secondary-masonry foundation",
      "from": [
        5,
        1,
        8
      ],
      "op": "cuboid",
      "to": [
        22,
        2,
        22
      ]
    },
    {
      "block": "cobble",
      "comment": "rear service foundation",
      "from": [
        2,
        1,
        22
      ],
      "op": "cuboid",
      "to": [
        14,
        2,
        29
      ]
    },
    {
      "block": "cobble",
      "comment": "kitchen bump foundation",
      "from": [
        14,
        1,
        21
      ],
      "op": "cuboid",
      "to": [
        21,
        2,
        25
      ]
    },
    {
      "block": "cobble",
      "comment": "east reading-bay foundation",
      "from": [
        23,
        1,
        11
      ],
      "op": "cuboid",
      "to": [
        25,
        2,
        16
      ]
    },
    {
      "block": "gravel",
      "comment": "south road approach",
      "from": [
        10,
        3,
        0
      ],
      "op": "cuboid",
      "to": [
        16,
        3,
        3
      ]
    },
    {
      "block": "dark_planks",
      "comment": "sheltered projecting porch deck",
      "from": [
        7,
        3,
        4
      ],
      "op": "cuboid",
      "to": [
        20,
        3,
        7
      ]
    },
    {
      "block": "gravel",
      "comment": "rear service apron",
      "from": [
        5,
        3,
        30
      ],
      "op": "cuboid",
      "to": [
        10,
        3,
        31
      ]
    },
    {
      "block": "gravel",
      "comment": "west exterior return path",
      "from": [
        0,
        3,
        18
      ],
      "op": "cuboid",
      "to": [
        4,
        3,
        20
      ]
    },
    {
      "block": "stone_floor",
      "comment": "main ground floor",
      "from": [
        5,
        3,
        8
      ],
      "op": "cuboid",
      "to": [
        22,
        3,
        22
      ]
    },
    {
      "block": "stone_floor",
      "comment": "service ground floor",
      "from": [
        2,
        3,
        22
      ],
      "op": "cuboid",
      "to": [
        14,
        3,
        29
      ]
    },
    {
      "block": "brick",
      "comment": "kitchen floor and hearthwork",
      "from": [
        14,
        3,
        21
      ],
      "op": "cuboid",
      "to": [
        21,
        3,
        25
      ]
    },
    {
      "block": "dark_planks",
      "comment": "reading-bay floor",
      "from": [
        23,
        3,
        11
      ],
      "op": "cuboid",
      "to": [
        25,
        3,
        16
      ]
    },
    {
      "block": "stone_default",
      "comment": "main house stone and timber mass",
      "from": [
        5,
        3,
        8
      ],
      "op": "cuboid",
      "to": [
        22,
        11,
        22
      ]
    },
    {
      "block": "stone_mossy",
      "comment": "weathered rear service wing mass",
      "from": [
        2,
        3,
        22
      ],
      "op": "cuboid",
      "to": [
        14,
        9,
        29
      ]
    },
    {
      "block": "stone_default",
      "comment": "kitchen projection mass",
      "from": [
        14,
        3,
        21
      ],
      "op": "cuboid",
      "to": [
        21,
        9,
        25
      ]
    },
    {
      "block": "stone_default",
      "comment": "east reading-bay projection",
      "from": [
        23,
        3,
        11
      ],
      "op": "cuboid",
      "to": [
        25,
        11,
        16
      ]
    },
    {
      "block": "brick",
      "comment": "roof-piercing west chimney mass",
      "from": [
        3,
        3,
        13
      ],
      "op": "cuboid",
      "to": [
        6,
        21,
        16
      ]
    },
    {
      "block": "air",
      "comment": "main ground room volume",
      "from": [
        7,
        4,
        9
      ],
      "op": "cuboid",
      "to": [
        21,
        6,
        21
      ]
    },
    {
      "block": "air",
      "comment": "pantry workshop and rear hall volume",
      "from": [
        3,
        4,
        23
      ],
      "op": "cuboid",
      "to": [
        13,
        6,
        28
      ]
    },
    {
      "block": "air",
      "comment": "kitchen volume",
      "from": [
        14,
        4,
        21
      ],
      "op": "cuboid",
      "to": [
        20,
        6,
        24
      ]
    },
    {
      "block": "air",
      "comment": "reading-bay ground reveal",
      "from": [
        23,
        4,
        12
      ],
      "op": "cuboid",
      "to": [
        24,
        6,
        15
      ]
    },
    {
      "block": "air",
      "comment": "approach and porch player clearance",
      "from": [
        10,
        4,
        0
      ],
      "op": "cuboid",
      "to": [
        16,
        6,
        7
      ]
    },
    {
      "block": "air",
      "comment": "rear apron clearance",
      "from": [
        5,
        4,
        30
      ],
      "op": "cuboid",
      "to": [
        10,
        6,
        31
      ]
    },
    {
      "block": "air",
      "comment": "west return clearance",
      "from": [
        0,
        4,
        18
      ],
      "op": "cuboid",
      "to": [
        4,
        6,
        20
      ]
    },
    {
      "block": "dark_planks",
      "comment": "timber upper floor",
      "from": [
        6,
        7,
        9
      ],
      "op": "cuboid",
      "to": [
        21,
        7,
        21
      ]
    },
    {
      "block": "air",
      "comment": "upper residential volume",
      "from": [
        6,
        8,
        9
      ],
      "op": "cuboid",
      "to": [
        21,
        10,
        21
      ]
    },
    {
      "block": "air",
      "comment": "double-height hearth opening",
      "from": [
        10,
        7,
        12
      ],
      "op": "cuboid",
      "to": [
        15,
        10,
        16
      ]
    },
    {
      "block": "dark_planks",
      "comment": "projecting reading-bay upper floor",
      "from": [
        23,
        7,
        11
      ],
      "op": "cuboid",
      "to": [
        25,
        7,
        16
      ]
    },
    {
      "block": "air",
      "comment": "study reading-bay volume",
      "from": [
        23,
        8,
        11
      ],
      "op": "cuboid",
      "to": [
        25,
        10,
        16
      ]
    },
    {
      "block": "dark_planks",
      "comment": "west loft route floor",
      "from": [
        7,
        7,
        17
      ],
      "op": "cuboid",
      "to": [
        9,
        7,
        21
      ]
    },
    {
      "block": "air",
      "comment": "west loft route clearance",
      "from": [
        7,
        8,
        13
      ],
      "op": "cuboid",
      "to": [
        9,
        10,
        21
      ]
    },
    {
      "block": "dark_planks",
      "comment": "upper gallery floor",
      "from": [
        16,
        7,
        12
      ],
      "op": "cuboid",
      "to": [
        18,
        7,
        21
      ]
    },
    {
      "block": "air",
      "comment": "upper gallery clearance",
      "from": [
        16,
        8,
        12
      ],
      "op": "cuboid",
      "to": [
        18,
        10,
        21
      ]
    },
    {
      "block": "stone_cracked",
      "comment": "vestibule compression wall",
      "from": [
        7,
        4,
        11
      ],
      "op": "cuboid",
      "to": [
        16,
        6,
        11
      ]
    },
    {
      "block": "stone_cracked",
      "comment": "dining butler partition",
      "from": [
        17,
        4,
        18
      ],
      "op": "cuboid",
      "to": [
        21,
        6,
        18
      ]
    },
    {
      "block": "dark_log",
      "comment": "pantry workshop divider",
      "from": [
        8,
        4,